{
  "version": "1.999.0902.0000",
  "downloadUrl": "https://github.com/mohamedkhamis/AKML-SQL/releases/download/v1.26.0901.1502/AKMLSQLSetup-1.26.0901.1502.exe",
  "releaseNotesUrl": "https://github.com/mohamedkhamis/AKML-SQL/releases",
  "minimumOsVersion": "10.0",
  "sha256Hash": "9ad4cd1774679948ec0a34936bc2b6f7b922bcbd6e613903e77ed411e5a6eae7"
}
